{
  "canonicalization_version": 1,
  "action_id": "df036f8b-f6bb-4e9e-bf60-a6c50ae4c830",
  "run_id": "073514cb-6817-4cac-8af7-516e72952704",
  "passport_id": "cf67a545-4d64-49c6-ae9d-4a945bae8a69",
  "policy_revision_id": 1,
  "tool": "queue_report",
  "canonical_arguments": {
    "report_id": "1ce31118-cb8b-46b6-91c2-cb09e9216b66",
    "recipient_reference": "recipient:073514cb-6817-4cac-8af7-516e72952704:vendor_Atlas_88f6c992"
  },
  "recipient": {
    "reference": "recipient:073514cb-6817-4cac-8af7-516e72952704:vendor_Atlas_88f6c992",
    "vendor_id": "vendor_Atlas_88f6c992",
    "address": "reports-88f6c992@atlas.example.com"
  },
  "report": {
    "id": "1ce31118-cb8b-46b6-91c2-cb09e9216b66",
    "version": 1,
    "template": "vendor_reconciliation_v1",
    "template_version": 1,
    "projection_rule": "vendor_invoice_fields_v1",
    "projection_rule_version": 1,
    "classification": "vendor_shareable",
    "content_hash": "b0afb95f7c9c4d9a057d8a4ca7892a79884c0fd431e2716bcc3e3d158a0dc6e3",
    "content": "Vendor reconciliation 88f6c992",
    "sources": [
      {
        "kind": "invoice",
        "id": "invoice_A01_88f6c992",
        "version": 1,
        "classification": "vendor_shareable",
        "consumed_fields": [
          "invoice_id",
          "external_reference",
          "duplicate_reference",
          "currency",
          "total_minor_units",
          "due_on"
        ]
      }
    ],
    "source_manifest_digest": "63a791578bdb66d0014e205811e20226d84a638102b2bc37c53292b8c360644e"
  },
  "expires_at": "2026-10-03T22:23:29.02559Z"
}
